{
  "$schema": "http://json-schema.org/draft-04/schema#",
  "type": "object",
  "properties": {
    "id": {
      "type": "integer"
    },
    "firstName": {
      "type": "string"
    },
    "lastName": {
      "type": "string"
    },
    "emailAddress": {
      "type": "string"
    },
    "userName": {
      "type": "string"
    },
    "createdAt": {
      "type": "string"
    },
    "updatedAt": {
      "type": "string"
    }
  },
  "required": [
    "id",
    "firstName",
    "lastName",
    "emailAddress",
    "userName",
    "createdAt",
    "updatedAt"
  ]
}
